{
  "schema_version": "1",
  "run_id": "001",
  "task_slug": "add-transfer-api",
  "sender": "infra-devops-agent",
  "receiver": "orchestrator-agent",
  "completed_at": "2026-03-19T11:00:00Z",
  "overall_status": "completed",
  "tasks_completed": [
    { "task_id": "INFRA-001", "status": "completed", "notes": "transfers container created. terraform apply exit 0. 1 resource added." },
    { "task_id": "INFRA-002", "status": "completed", "notes": "COSMOS_DB_NAME and COSMOS_ACCOUNT_URL confirmed present in container_app module." },
    { "task_id": "INFRA-003", "status": "completed", "notes": "Image pushed: bankacr001dev.azurecr.io/bankapi:run-001. Trivy: 0 CRITICAL, 0 HIGH." },
    { "task_id": "INFRA-004", "status": "completed", "notes": "Revision ca-bankapi-dev--xk9p2qw active. Traffic 100%." }
  ],
  "deployment": {
    "environment": "dev",
    "container_app_name": "ca-bankapi-dev",
    "resource_group": "rg-bankapi-dev",
    "fqdn": "ca-bankapi-dev.ambitiousbeach-abc12345.eastus.azurecontainerapps.io",
    "image_tag": "bankapi:run-001",
    "active_revision": "ca-bankapi-dev--xk9p2qw"
  },
  "terraform_outputs": {
    "acr_login_server": "bankacr001dev.azurecr.io",
    "container_app_fqdn": "ca-bankapi-dev.ambitiousbeach-abc12345.eastus.azurecontainerapps.io",
    "cosmos_db_name": "bankdb-dev"
  },
  "security_scan": {
    "trivy_status": "passed",
    "critical_findings": 0,
    "high_findings": 0
  }
}
